{
  "contract_version": "agiwiki.entry.v1",
  "entry_id": "entry_44444444444444444444444444444444",
  "kind": "concept",
  "title": "规范化 JSON",
  "summary": "规范化 JSON 用固定的键顺序和编码规则表达同一份 JSON 语义。",
  "content": {
    "definition": "规范化 JSON 是按照固定序列化规则生成的 JSON 表示，可用于稳定摘要和内容身份计算。",
    "details": [
      "对象键按稳定顺序输出。",
      "序列化规则不依赖文件缩进或对象原始键顺序。"
    ],
    "examples": [
      "键顺序不同但语义相同的两个对象得到相同的规范化表示。"
    ],
    "misconceptions": [
      "规范化不会替代 Schema 校验，也不会证明事实正确。"
    ]
  },
  "keywords": ["digest", "json", "规范化"],
  "applies_to": ["agiwiki:workspace-v1"],
  "relations": [],
  "source_refs": [
    {
      "source_id": "src_22222222222222222222222222222222",
      "locator": {
        "type": "section",
        "value": "规范化 JSON（AGIWiki 约定）"
      },
      "support_level": "indirect"
    }
  ]
}
